{
  "name": "eval-smoke-fresh",
  "seed": "eval-smoke-v1",
  "strategy": "sim/strategies/basic-6d-h17-das-ls.json",
  "mode": "fresh-round",
  "rounds": 10000,
  "paths": 20,
  "penetrationPercent": 75,
  "observerSeats": 1,
  "roundsPerHour": 100,
  "confidenceZ": 1.96,
  "riskBankrollUnits": [50, 100, 200, 500, 1000],
  "retention": {
    "mode": "sampled",
    "sampleEvery": 1000,
    "acknowledgeLargeOutput": false
  }
}
